{
  "$schema": "http://json-schema.org/draft-07/schema#",
  "$id": "https://github.com/jacbeekers/metadata-registry-interface-specifications/blob/master/metadata/schemas/interface/0.2.0/physical_attribute.json",
  "title": "Physical Attribute",
  "description": "Description of the physical attribute",
  "required": [
    "meta",
    "meta_version",
    "attribute_list",
    "physical_entity",
    "version"
  ],
  "type": "object",
  "properties": {
    "meta": {
      "type": "string",
      "description": "metadata type",
      "enum": [
        "physical_attribute"
      ]
    },
    "meta_version": {
      "type": "string",
      "description": "the meta structure version for the object",
      "pattern": "^([0-9]+).([0-9]+).*$"
    },
    "attribute_list": {
      "type": "array",
      "items": {
        "$ref": "#/definitions/attribute"
      },
      "uniqueItems": true
    },
    "physical_entity": {
      "oneOf": [
        {
          "type": "string",
          "format": "uuid",
          "pattern": "^(.+)-(.+)-(.+)$"
        }
      ],
      "description": "Physical entity the attribute belongs to. In this version only uuids, references to existing physical entities, are allowed."
    },
    "version": {
      "description": "The metadata version number of the attribute list. Increase whenever something changes.",
      "pattern": "^([0-9]+).([0-9]+).([0-9]+)$",
      "type": "string"
    }
  },
  "definitions": {
    "attribute": {
      "type": "object",
      "required": [
        "uid",
        "name"
      ],
      "properties": {
        "uid": {
          "description": "The unique identifier of the physical attribute.",
          "type": "string",
          "format": "uuid"
        },
        "name": {
          "description": "The name of the physical attribute.",
          "type": "string"
        },
        "description": {
          "description": "The description of the physical attribute.",
          "type": "string"
        },
        "datatype": {
          "description": "The data type of the physical attribute.",
          "type": "string"
        }
      }
    }
  }
}
